{"schema_version":"town-agent-driver-ready/1","adapter_instance_id":"01K00000000000000000000000","contracts":["town-agent-driver/1"],"profiles":[{"id":"nanda/agent/capability-fulfillment","version":"1","digest":"sha256:436622e70cd84690e39c24f93236c7639adefea2fe9ea72a1dddb25e65609c58"}],"accepting_runs":true,"limits":{"max_active_runs":1,"max_request_bytes":65536,"max_response_bytes":65536}}
